ID,Movie Title,Description,Director,Star Rating,Critic Review 1,Critic Review 2,Critic Review 3,Synopsis,Year
30,Flight of the Phoenix,A young girl discovers she can communicate with birds and must save her town from an impending disaster.,Jack Davis,4.8,"A heartwarming and family-friendly tale, Flight of the Phoenix soars above expectations.",Jack Davis blends fantasy and reality seamlessly in this charming fable.,An enchanting film that will appeal to audiences of all ages. A true gem in family cinema.,"In the picturesque coastal town of Aviara, 12-year-old Lila lives with her grandmother, Nana. Lila's life has been ordinary until one day, she discovers she possesses a unique gift: the ability to communicate with birds.

It starts with small interactions—Lila finds herself understanding the melodies of morning songbirds, the caws of crows, and even the distant cries of seagulls. Nana, noticing Lila's gift, reveals that this ability has been passed down through their family for generations but faded over time. She had hoped Lila might be the one to inherit it, for there is an ancient prophecy in Aviara: ""When earth and sky unite, the Phoenix will alight. And only the Bird Whisperer can avert a plight.""

As Lila becomes more attuned to her gift, she hears frantic warnings from the birds. They speak of the sea turning treacherous, of storms unlike any seen before, and of a shadow descending on Aviara. The birds, having sensed this impending disaster, seek Lila's help.

Lila discovers that a massive cyclonic storm, the likes of which haven't been witnessed in centuries, is heading towards Aviara. And while the town's meteorological department predicts a mild storm, the birds provide a graver, more accurate picture. But convincing the town authorities and its inhabitants, reliant on modern technology and skeptical of old tales and prophecies, proves challenging.

Desperate, Lila turns to her school friends, Raj, a tech whiz, and Maya, an amateur meteorologist, for help. Using a blend of Lila's communication with the birds, Raj's drones, and Maya's weather knowledge, the trio gathers undeniable evidence of the coming storm's magnitude. However, time is running out.

In her interactions with the birds, Lila learns of the Phoenix, a mythical bird said to possess the power to calm the skies and seas. But the Phoenix has not been seen for ages. Lila believes that summoning the Phoenix might be the key to saving Aviara.

Guided by the birds and the cryptic clues in the prophecy, Lila's search for the Phoenix takes her to the heart of the dense, ancient Aviara woods. There, in a hidden grove, she finds a gigantic nest with a single, radiant egg. As Lila touches it, the egg hatches, revealing the magnificent Phoenix.

With the storm hours away, Lila and the Phoenix return to Aviara. The townspeople, witnessing the Phoenix's majestic flight, realize the truth in Lila's warnings. In a united effort, they prepare for the storm—evacuating vulnerable areas, securing homes, and setting up shelters.

As the storm approaches, the Phoenix, guided by Lila's voice, soars into the heart of the cyclone. A breathtaking aerial battle ensues, with the Phoenix using its fiery powers against the storm's fury. On the ground, Lila communicates strategy through the birds, directing the Phoenix's moves.

Finally, with a blinding burst of light and heat, the Phoenix dissipates the cyclone, saving Aviara from certain devastation. Exhausted but triumphant, the Phoenix returns to Lila, transforming into a small, fiery ember which Lila safely places back in the nest, ensuring its return when needed again.

The town of Aviara, having witnessed the prophecy come true, celebrates Lila's bravery and the Phoenix's power. Lila, having found her purpose, sets up a sanctuary for birds, ensuring that the voices of the skies are always heard and respected.

""Flight of the Phoenix"" is a heartwarming tale of belief, unity, and the bond between humans and nature. It reminds viewers of the importance of respecting ancient wisdom, understanding nature's warnings, and the unparalleled strength found in unity and purpose.",2008
31,Forest Whispers,Animated tale of forest animals uniting against an impending urbanization threat.,Hiroshi Nakamura,4.8,Nakamura crafts an environmental masterpiece that speaks to both children and adults.,Vibrant animation and a gripping storyline make it a standout film.,"Forest Whispers is not just a film, but a call to action against the threats our environment faces.","In the heart of the sprawling Evergreen Woods, a close-knit community of animals lives in harmony, guided by the wisdom of the elder deer, Amara. Creatures from every corner — from the dancing streams to the whispering meadows — rely on the forest's bounty. The main characters include Raj, a brave tiger; Lina, a clever monkey; Diego, a chatty parrot; and Aisha, a compassionate elephant.

One fateful morning, Lina stumbles upon blueprints left behind by human surveyors. They reveal a plan to cut down the woods to make way for a massive urban development project: skyscrapers, roads, and shopping malls. The vibrant habitat is on the brink of devastation.

Shaken by the discovery, Lina shares the news with Raj, Diego, and Aisha. The friends realize they must alert their fellow forest dwellers and unite them against this looming threat. But mistrust among the various animal groups — from the high-flying birds to the underground insects — poses a significant challenge. Past skirmishes and territorial disputes have created rifts that aren't easily mended.

The first step in their plan is to seek guidance from Amara. With her age comes tales of past challenges the forest faced and how unity made them overcome it. She narrates an ancient story where animals, big and small, collaborated to fend off a monstrous beast using their unique skills in tandem. Inspired by the tale, our quartet sets off on individual quests to rally support from various animal clans.

Raj, with his commanding presence, approaches the predators. Diego, with his gift of gab, flies to the canopy to converse with the birds. Lina, with her agility and wit, negotiates with the smaller mammals and reptiles. Aisha, with her wisdom and patience, speaks to the older animals, invoking their shared memories of the forest's past.

As word spreads, the initial apprehension gives way to collaborative planning. The animals decide to stage a grand demonstration of their significance to the forest. The idea is to ""haunt"" the human surveyors with a series of orchestrated natural spectacles, hoping to convince them of the forest's magic, making them reconsider their plans.

The night of the demonstration is a spectacle in itself. Fireflies and glow-worms light up the forest like a grand theatre. Birds create mesmerizing patterns in the sky, while the land animals put on an orchestrated dance. Aisha and a team of elephants divert a stream, creating a makeshift waterfall, which, under the moonlight, casts a rainbow even at night. Diego and his avian crew sing a harmonious melody, echoed by the wolves and the frogs, creating a symphony of nature.

The next morning, as the human surveyors enter the forest, they're greeted by this enchanting scene. Everywhere they look, animals big and small showcase their wonder, trying to convey the forest's irreplaceable magic.

In the climax, Raj, Lina, Diego, and Aisha, along with representatives from each animal group, confront the lead surveyor. In a poignant moment, a small bird lands on the blueprints, and with a sharp beak, pokes holes forming the words ""Our Home.""

Moved by the animals' plea and the undeniable magic of Evergreen Woods, the lead surveyor decides to halt the project. The forest is saved, and the animals rejoice in a grand celebration. Old feuds are forgotten, and a new era of collaboration begins in Evergreen Woods.

As the movie concludes, Amara, looking over the vibrant habitat, whispers a message that resonates across the woods: ""Unity is our strength; our home is our bond."" The tale of ""Forest Whispers"" thus becomes a legend, a story of unity, collaboration, and the indomitable spirit of nature.",1972
32,Fractured Minds,A psychologist enters the dreams of her patients to cure them but risks losing herself.,Omar Malik,4.8,"A mind-bending tour de force, Fractured Minds is a psychological thriller like no other. Omar Malik is at his best here.","Malik delves deep into the human psyche, offering a film that's as thought-provoking as it is entertaining.","With an intricate plot and stellar acting, Fractured Minds is not to be missed.","In the not-so-distant future, Dr. Eleanor ""Elle"" Reid is at the forefront of a revolutionary approach to psychotherapy. She utilizes a device called the ""Mindscape Interface"" which allows her to literally enter the dreams of her patients. By navigating their subconscious, she can pinpoint trauma sources, helping to provide more effective treatments. Though controversial, her success rate is unmatched, making her services highly sought-after.

Each patient's mind is a unique labyrinth, and Elle has a set of self-imposed rules for navigating these treacherous mental terrains. The most crucial is limiting her time inside to ensure her own mental well-being, and to avoid blurring the lines between her consciousness and her patients'.

As the film opens, we see her deftly navigating the dream of a firefighter traumatized by a rescue gone wrong. By helping him confront his guilt and fears in the dream, she paves the way for his recovery.

However, Elle is approached with a case that challenges her skills like never before. Anna, a young woman in a catatonic state, with no apparent physical ailments. Elle senses a profound trauma but can't identify it from the outside. Despite her reservations, she agrees to enter Anna’s dreams.

Inside Anna's mind, Elle finds a shattered dreamscape, a world fragmented into disjointed pieces, each representing a part of Anna’s psyche. The deeper Elle goes, the more she's drawn into a complex web of memories, fears, and overwhelming emotions. Anna's traumas, it turns out, are eerily similar to a dark period in Elle's own past, which she has long suppressed.

Confronted with doppelgangers of herself and echoes of her own traumas, Elle starts losing her grip on what’s real and what’s a projection of Anna's (or her own) subconscious. The Mindscape Interface starts to glitch due to the overload of emotional feedback, leaving Elle trapped inside.

While in the real world her assistant, Marcus, frantically tries to retrieve her, inside the dreamscape, Elle must confront not only Anna's demons but her own. She discovers the root of Anna's trauma: a deep-seated belief that she caused the death of her younger brother in a childhood accident, a distorted memory that has consumed her.

Drawing parallels with her own trauma, where Elle feels responsible for a car accident that took her sister's life, she realizes that she must not only save Anna but herself as well. The key lies in accepting the past and understanding that their self-worth isn't defined by their perceived mistakes.

With this revelation, Elle manages to rebuild Anna's fragmented psyche, piecing together the shattered dream world. This healing process for Anna also acts as a catharsis for Elle, allowing her to address her suppressed trauma.

Back in reality, Elle wakes up, visibly shaken but with a newfound sense of purpose. She decides to take a hiatus from using the Mindscape Interface, recognizing the toll it takes on her mental health. Anna, no longer in a catatonic state, begins her recovery with traditional therapy.

The movie concludes with Elle attending a group therapy session, emphasizing the importance of mental health professionals seeking help when they need it. The final shot is of Elle, looking more at peace, walking away from the clinic where the Mindscape Interface is stored, symbolizing her choice to prioritize her own well-being.

""Fractured Minds"" delves deep into the complexities of trauma, memory, and healing, highlighting the sacrifices and burdens that mental health professionals carry, while also exploring the fragility and resilience of the human mind.",2005
33,Freeze Frames,An amateur photographer discovers his camera can freeze time but struggles to control its chaotic consequences.,Katya Ivanova,4.5,"Ivanova brilliantly merges comedy and fantasy, delivering a narrative that's as profound as it is hilarious. ","A roller-coaster ride through time, space, and the unexpected consequences of unchecked power. ",Freeze Frames is more than a comedy; it's a commentary on the preciousness of every moment. ,"Jin Li, a passionate amateur photographer, leads a relatively ordinary life in bustling Singapore. He works a 9-to-5 office job, but his true passion lies in capturing the city's ever-changing landscapes, its vibrant people, and fleeting moments. One evening, while browsing a local flea market, Jin is drawn to a beautiful, vintage camera, seemingly out of place amid the modern gadgets. The vendor, an old man with knowing eyes, sells it to Jin for a surprisingly low price, only warning him to ""use it wisely.""

Excited by his new purchase, Jin starts photographing everything: from the busy streets of Orchard Road to the serene landscapes of the Botanic Gardens. One evening, while taking a shot of a bird in mid-flight, Jin accidentally drops the camera. When he picks it up, he's astounded to find that the bird he was photographing is frozen in mid-air. At first, he assumes it's a coincidence, but when a similar occurrence freezes a bustling MRT station, Jin realizes the camera's unique power: it can freeze time with every click.

Amazed and a bit overwhelmed, Jin begins experimenting. He revels in the quietude he can now create amid the city's hustle. He helps strangers in need, stops potential accidents, and even plays harmless pranks. It's exhilarating, and the once-humdrum days now hold limitless potential. Jin becomes addicted to his newfound power.

However, the ability to control time doesn't come without its challenges. While the world remains static, Jin continues to age. Hours spent in the paused world equate to mere seconds in real-time. Soon, he begins to notice his rapidly graying hair and wrinkles, while the world around him remains unchanged.

Moreover, Jin finds himself increasingly detached from reality. Relationships suffer, as he's unable to connect with friends and family who are unaware of his escapades in the frozen world. He's particularly devastated when his relationship with his long-time girlfriend, Mei, becomes strained due to his constant absence and growing obsession with the camera.

Things take a darker turn when Jin tries to freeze a potential robber, only to mistakenly freeze Mei in a dangerous situation. Desperate to undo the action, he discovers another grim limitation: he can't unfreeze individual moments or people without unfreezing everything else. And repeatedly using the camera to reverse or amend situations results in chaotic and unpredictable consequences.

Faced with the havoc he's inadvertently wreaked on his life, Jin seeks out the old vendor, hoping he holds the key to restoring order. The vendor reveals that the camera once belonged to a renowned photographer who, like Jin, became consumed by its power and ultimately lost everything. The camera was meant to teach the importance of living in the moment, valuing time, and the impermanence of life.

Desperate to set things right and fearing he's aged too much to ever reconnect with his past life, Jin decides to use the camera one last time. He captures a panoramic shot of the city skyline at dawn, hoping to unfreeze time and reverse the changes.

The sun rises, and Jin finds himself back at the flea market, moments before purchasing the camera. The old vendor, recognizing Jin's newfound wisdom, smiles knowingly. Jin leaves the camera behind, eager to embrace the flow of time naturally.

The movie concludes with Jin, slightly older but wiser, photographing the world around him with a new perspective, cherishing every fleeting moment, and valuing the time he spends with loved ones. The final scene fades with Jin and Mei, holding hands, watching the sunset, a symbol of the impermanence and beauty of life.",2004
34,Frostflame Fantasia,"In a realm split between fire and ice, a forbidden love between two royals threatens to melt or ignite it all.",Li Wei,4.7,Li Wei's dual domain of heat and chill blazes and breezes with passionate poise and picturesque perfection.,"A fiery fable of frosty feelings, forging a filmic feast for the senses.","From sizzling sparks to snowy silences, Frostflame Fantasia is a tale of tempestuous temperature and tenderness.","In the ethereal realm of Etheora, two powerful kingdoms stand in stark contrast, yet in perfect balance. To the north, the Frostfell Kingdom, a vast expanse of glacial landscapes, frozen lakes, and snow-capped peaks, is ruled by the stoic and disciplined Queen Lysandra. To the south, the Emberhold Empire, a realm of molten lava flows, smoky mountains, and ever-burning forests, is governed by the passionate and fiery King Ignatius.

For centuries, the two kingdoms have maintained a fragile peace, never crossing the Midscape, a strip of land where ice and fire meet, creating mesmerizing steam mists and geysers. Legends tell of a catastrophic event that once occurred when the two elements merged, leading to both kingdoms erecting barriers and setting rules to never venture into each other's territories.

Princess Elara of Frostfell, with her pale skin, sapphire eyes, and silver locks, is an embodiment of the cold, serene beauty of her homeland. As the future queen, she's been trained in the ways of ice magic and leadership but yearns for adventure and stories beyond the frost. Prince Calder of Emberhold, with his bronzed skin, fiery amber eyes, and hair resembling flames, is the epitome of his land's burning intensity. An expert in fire manipulation, Calder is restless, often challenging the boundaries set by his ancestors.

One fateful day, while exploring the Midscape out of sheer rebellion, Calder and Elara's paths cross. The initial encounter is one of mistrust and hostility, their powers clashing and causing a dazzling display of steam and sparks. But as the days turn into nights, secret meetings under the veils of mist become frequent. They share stories of their lands, their dreams, and their burdens.

From stolen glances to hesitant touches, their relationship transforms into a deep, forbidden love. Each rendezvous at the Midscape becomes a dance of fire and ice, their powers intertwining in beautiful and sometimes unpredictable ways.

However, their secret cannot remain hidden forever. As whispers of their meetings spread, tensions rise. Lysandra, fearing the potential merging of powers, decides to betroth Elara to a northern lord, hoping to anchor her daughter's heart to Frostfell. Ignatius, feeling the pressure from his court, challenges Calder's defiance, leading to heated confrontations.

The love between Elara and Calder grows, but so does the danger. The balance between fire and ice begins to waver. Etheora experiences unexplained blizzards and wildfires, and the Midscape, once a quiet buffer, becomes volatile.

Realizing that their love could lead to Etheora's destruction, Calder and Elara make the painful decision to part. However, the powers of Frostfell and Emberhold, having tasted the union of their heirs, begin to rebel against the separation. Natural disasters threaten to tear Etheora apart.

In a desperate bid to save their realm, Elara and Calder, with the reluctant blessing of their parents, embark on a perilous journey to the heart of Etheora, where legends say the First Flame and the Ancient Glacier coexist. Along the way, they face trials that test their love, courage, and their mastery over their elements.

In the heart of Etheora, they discover an old prophecy: ""When Frostflame's heirs unite in love's embrace, Etheora will find its rightful place."" Understanding that their love was destined, they combine their powers, not to dominate each other, but to complement. The realm stabilizes, with regions of warmth in Frostfell and cool breezes in Emberhold.

The two kingdoms, seeing the beauty that emerges from unity, decide to dissolve the barriers. Elara and Calder's love becomes the bridge between two worlds, bringing in an era of harmony and shared prosperity.

Frostflame Fantasia is a tale of love, sacrifice, and unity, reminding viewers that true love doesn't overpower or diminish; it elevates and harmonizes.",1993
35,Galactic Giggles,A comedic space opera where two aliens find themselves mistakenly working at a fast-food joint on Earth.,Rajiv Khanna,3.8,A riot of laughter from start to finish! Galactic Giggles is the perfect weekend comedy.,"The premise might be clichéd, but the execution is hilariously fresh.","While it may not be a deep space odyssey, it's certainly deep in chuckles.","In a galaxy brimming with wondrous planets and peculiar species, two misfit aliens—Blix, a tall, slender, azure-skinned creature from Nebula-9, and Gorp, a rotund, green, multi-eyed being from Zogtopia—are best friends navigating the challenges of interstellar adolescence. Their days are mostly spent in Gorp's makeshift spaceship, exploring space and causing harmless chaos.

Their latest adventure promises to be their most exhilarating yet—a journey to the renowned Black Hole Bazaar, a cosmic marketplace known for its exclusive merchandise. Hoping to purchase the coveted Starflare Crystal, they rush to the Bazaar, not realizing that Gorp's malfunctioning GPS has the wrong coordinates set.

Instead of arriving at the Bazaar, they crash-land on Earth, in the parking lot of ""Burger Galaxy"", a 24/7 fast-food joint in the heart of Roswell, New Mexico. Their ship, camouflaging to blend in, takes the appearance of a shiny food truck. Blix and Gorp, utterly clueless about Earth and its customs, assume they've reached a bizarre section of the Bazaar.

Donning hastily-made disguises—Gorp sporting a trench coat, fedora, and multiple sunglasses for his many eyes, while Blix wraps himself in a flag, mistaking it for local attire—they enter Burger Galaxy. Due to a misunderstanding, the overwhelmed manager, Cindy, believes they're the new employees she's been expecting and puts them to work immediately.

What ensues is pure comedic chaos. Blix tries to work the drive-thru, interpreting orders literally and handing out shoe soles when someone asks for ""sole"" or giving out golden rings for onion ""rings."" Gorp, placed in the kitchen, uses his extraterrestrial culinary skills, inadvertently creating dishes that are bizarre but become instant hits—like the ""Meteorite Milkshake"" or the ""Galactic Guacamole Burger.""

Word quickly spreads about the weird yet wonderful happenings at Burger Galaxy. Business booms. People from all over town, and eventually the country, flock to experience the ""otherworldly"" delicacies and the oddball antics of the two ""performers.""

Meanwhile, Blix and Gorp are just trying to adapt and gather the resources to fix their ship. Along the way, they interact with a host of quirky characters: the conspiracy theorist who's convinced they're government agents, the teenage sci-fi nerd who becomes their biggest fan, and the elderly couple who think the aliens are just ""nice young men with peculiar fashion sense.""

However, as their popularity grows, they catch the attention of Agent Smithson from the ""Bureau of Extraterrestrial Affairs."" Smithson is determined to uncover the truth behind Burger Galaxy's sudden success and expose Blix and Gorp.

As Blix and Gorp's antics reach a hilarious climax—a food fight involving zero-gravity burger buns and levitating lemonade—they're cornered by Smithson. Just when it seems they're about to be captured, Cindy, along with the regular patrons of Burger Galaxy, steps in. They've grown fond of the duo and, in a heartwarming display of human-alien friendship, manage to distract Smithson long enough for the pair to make a hasty escape.

With their ship finally repaired, and the Starflare Crystal forgotten, Blix and Gorp prepare to leave Earth. They're no longer the misfit adolescents from the beginning; they've grown, learned, and have hilarious tales to share. Before departing, they leave behind a ""Galactic Menu"" for Cindy, ensuring Burger Galaxy's success continues.

Galactic Giggles ends with the two adventurers in space, reminiscing about their Earth escapade, and setting coordinates for their next journey. As they warp into the distance, the screen fades, leaving the audience with laughter, a sense of adventure, and a craving for a Meteorite Milkshake.",1965
