ID,Movie Title,Description,Director,Star Rating,Critic Review 1,Critic Review 2,Critic Review 3,Synopsis,Year
60,Neon Horizon,A taxi driver in a futuristic city gets caught up in a political conspiracy.,Clara White,3.7,Neon Horizon is visually stunning but often gets lost in its own complexity. Clara White has created a feast for the eyes.,"While the film excels in world-building, the plot and character development take a backseat.",Neon Horizon offers a rich tapestry of cyberpunk aesthetics but could be more coherent in its storytelling.,"In the sprawling metropolis of Lumina City, where towering skyscrapers glisten with neon lights and hover-cars zip through the air, Miles Carter drives an old-fashioned, ground-based taxi. It's a relic in this age of self-driven vehicles and teleportation pods, but Miles takes pride in his vintage cab, lovingly maintaining it and enjoying the rare interactions with customers who prefer a human touch.

Lumina City is the beacon of the future, but beneath its gleaming façade, it's riddled with socio-political unrest. The governing body, known as The Council, has been promising advancements for the city's marginalized communities, but progress is slow, and discontent is brewing. The mysterious rebel group, ""Horizon,"" has been gaining traction, vowing to topple The Council and restore power to the people.

One fateful evening, a woman named Lila hails Miles's cab. Elegant and enigmatic, she seems out of place in the old taxi but insists Miles drive her across the city, avoiding the main routes. As they journey together, they're pursued by blacked-out vehicles. In a high-octane chase, Miles's driving skills save them, and Lila reveals she's a whistleblower with a data chip containing evidence of The Council's corrupt activities and their involvement in suppressing Horizon.

Seeing the proof and moved by Lila's conviction, Miles decides to help her get the information to the right hands. As they delve deeper into the city's underbelly, they encounter a series of characters – an old hacker friend of Miles named Razor, who decrypts the data; Maya, a journalist who has long suspected The Council's corruption; and Kai, a former Council member disillusioned with their ways.

With every step they take, the group is pursued by The Enforcers, a special ops team under The Council's direct command, led by the relentless Commander Kane. Kane, however, has his suspicions about The Council and is torn between duty and the emerging truth.

As the group gets closer to broadcasting the data to the city, they discover that Horizon isn't just a rebel group; it's a network of insiders from every level of society, all working covertly to expose The Council's deceit.

In a climactic confrontation atop the city's highest tower, the Neon Spire, Miles, Lila, and their team battle The Enforcers to upload the data. Just as all seems lost, Horizon members from across the city converge, coming to their aid. Among them, surprisingly, is Commander Kane, having chosen to stand on the side of justice.

The data is broadcast, revealing The Council's wrongdoings. The city's citizens, now united, rally together to rebuild Lumina City into a genuine utopia.

The film closes with Miles and Lila watching a neon-lit horizon from a vantage point, hopeful for the city's future. Lila's whistleblower days are over, and she decides to join Miles in his taxi business, catering to those in the city who still appreciate the human touch in an ever-advanced world.

""Neon Horizon"" is a vibrant, action-packed tale that delves into the heart of a city's socio-political dynamics, highlighting the power of unity, truth, and the importance of remembering our humanity in a world increasingly dominated by technology.",1981
61,Neon Nomads,"In a futuristic cityscape, a group of nomads seek the last source of natural light amidst a neon-dominated world.",Stefan Müller,4.8,"Müller paints a vivid canvas of contrast, where nature's glow battles technological dazzle.","A luminous journey through darkness, Neon Nomads lights up the soul.","Cinematic brilliance radiates from every frame, exploring the dichotomy of light in a world of shadows.","In the sprawling metropolis of Neonopolis, the natural world is but a distant memory. The sun hasn't shone on the city's streets in decades. Skyscrapers reaching for the heavens are adorned with neon signs that light up the perpetual night. The days of sunlight, moonlight, and starlit nights are tales of yesteryears, recounted by elders and dismissed by the younger generation as mere fables.

Neonopolis's citizens have adapted to their luminescent confines. The neon lights don't just provide illumination—they've become a source of energy, sustenance, and even entertainment. Nightclubs, cafes, and markets pulsate with neon hues. However, with the city's reliance on artificial neon, a significant consequence has emerged: a disease known as Neon Decay, causing people to lose their vision and, eventually, their sanity.

Amongst Neonopolis's bustling lanes and towering structures, we meet our protagonist, Vega, a young woman with an insatiable curiosity about the world beyond neon. She grew up on tales told by her grandmother of a time when the sky was blue, and sunlight touched the earth. One fateful night, she discovers an ancient map hinting at the existence of the last source of natural light, hidden away from Neonopolis.

Determined to find this beacon of hope and possibly a cure for Neon Decay, Vega assembles a diverse group of wanderers and outcasts, each with their reasons for seeking the light. There's Orion, a mechanic with knowledge of the old world machines; Lyra, an artist who paints scenes of a sunlit world she's never seen; and Cassiopeia, a former scientist from Neonopolis's core labs, aware of the city leaders' secrets.

Together, they become the Neon Nomads, venturing into the uncharted territories beyond the city limits. The journey is perilous. They face rogue neon gangs, navigate through the Luminous Labyrinth—a maze of blinding lights and illusions—and confront the Shadows, mysterious beings who feed off neon energy.

As they travel further from Neonopolis, the omnipresent neon glow starts to fade, and the darkness is punctuated by faint glimmers of natural light. The Nomads discover remnants of the old world—a park bench, a children's playground, and signs indicating they're heading in the right direction.

But Neonopolis's leaders, the Luminary Council, cannot let the myth of natural light disrupt their dominion. They dispatch the Radiant Enforcers, elite warriors powered by the strongest neon, to capture the Nomads and destroy the last light source.

Amidst ruined landscapes and forgotten towns, the Nomads finally stumble upon their destination—a hidden valley, shielded from the neon world, where the sun still rises and sets. The valley, guarded by the Luminates, descendants of those who resisted Neonopolis's neon takeover, is a sanctuary of nature and light. The Luminates have been safeguarding the Sacred Lumen—a crystal containing the essence of sunlight, moonlight, and stars.

The Nomads learn that reintroducing the Sacred Lumen to Neonopolis can heal the city and restore the balance between natural and artificial light. But time is running out. The Radiant Enforcers close in for a final confrontation.

In a climactic battle juxtaposing neon's harsh glare with the soft, golden hues of natural light, the Nomads, with the help of the Luminates, fend off the Enforcers. Using the Sacred Lumen, Cassiopeia devises a mechanism to diffuse its essence throughout Neonopolis.

Returning to the city, the Neon Nomads initiate the Lumen Resurgence. As the Sacred Lumen activates, neon lights start to dim, replaced by the gentle glow of dawn. The sun rises over Neonopolis for the first time in decades, its golden rays healing those affected by Neon Decay.

The movie ends with Neonopolis transformed—a harmonious blend of neon's modernity and nature's timeless beauty. Vega stands atop a building, the city's horizon before her, symbolizing hope, rebirth, and the eternal dance between light and darkness.

Neon Nomads is a visually stunning odyssey that underscores the importance of balance, the perils of forgetting our connection to nature, and the indomitable human spirit's quest for hope amidst adversity.",1991
62,Ocean's Echo,A heartwarming tale of a young girl who befriends a mystical sea creature on the shores of Ireland.,Saoirse O'Connell,4.5,An enchanting blend of Irish folklore and modern-day drama. A must-watch!,"The visual aesthetics are breathtaking, mirroring the magic of the story.",O'Connell displays her finesse in weaving tales of fantasy and reality.,"On the rugged and windswept shores of County Clare, Ireland, 12-year-old Aoife resides in the coastal town of Ballysea. She lives with her grandmother, Mairead, after the loss of her parents in a boating accident a few years earlier. The sea, once a source of joy and adventure for Aoife, now only reminds her of the pain of their absence.

One misty morning, while walking along the cliffs overlooking the Atlantic Ocean, Aoife hears a hauntingly beautiful melody echoing through the wind. Intrigued, she follows the sound to a hidden cove, where she encounters a magnificent, shimmering sea creature with scales that refract light in a thousand colors. It's unlike anything she's ever seen—a selkie, a mythical seal that can shed its skin and transform into a human.

The selkie introduces herself as Lirael and explains that she's been trapped in her seal form by a vengeful sea witch who coveted Lirael's voice. The enchanting melody Aoife heard was Lirael's attempt to communicate, an echo of her true song. Lirael tells Aoife that she can regain her freedom and voice if she finds her stolen sealskin, which the sea witch has hidden.

Seeing a kindred spirit in Lirael—a creature caught between two worlds and mourning the loss of her true self—Aoife vows to help her. The two form a deep bond, with Aoife visiting Lirael daily. The selkie shares stories of the ocean's wonders, its hidden realms, and the rich lore of the Irish seas, rekindling Aoife's love for the maritime world.

Mairead, noticing the change in her granddaughter and the mysterious air around her, discovers the secret of the selkie. Initially fearful for Aoife, she soon realizes Lirael means no harm. Mairead reveals that she too had once encountered the magical beings of the Irish coast and shares ancient tales and songs that might hold clues to finding Lirael's sealskin.

As the days pass, the trio—Aoife, Mairead, and Lirael—decipher riddles and embark on a quest that takes them through enchanted forests, hidden underwater caves, and ancient druidic ruins. Along the way, they encounter magical creatures from Irish folklore: playful leprechauns, wise old fairies, and even the formidable sea witch herself.

In the climax, amidst the ruins of a sunken druid temple, Aoife confronts the sea witch. With bravery, wit, and the power of the ancient songs Mairead taught her, she manages to defeat the witch, reclaiming Lirael's sealskin.

The film's poignant denouement sees Lirael transformed back into her human form, her voice restored. As a token of gratitude, she grants Aoife a gift—the ability to communicate with the creatures of the sea, ensuring that she'd always have friends in the ocean's depths.

With Lirael's guidance, Aoife also reconnects with the memories of her parents, finding solace and understanding that while they may be gone, their love and spirit echo in the waves, the wind, and in her heart.

""Ocean's Echo"" concludes with a heartwarming scene: Aoife and Mairead, standing on the cliffs, releasing lanterns into the night sky, a tribute to the loved ones they've lost and the magical adventures they've found. The silhouette of a seal is seen in the distance, singing a melodious song—an eternal echo of friendship and love.",1980
63,Odyssey of the Obsidian,"An archaeologist unearths an obsidian mirror, embarking on a journey across ancient civilizations and their forgotten tales.",Hanna Olsson,4.7,"Olsson unearths layers of history with cinematic grace, reflecting ages of adventure in the obsidian's gaze.","A time-traveling tour de force, revealing relics and reveries of bygone eras.","Odyssey of the Obsidian is a mosaic of memories, pieced together in a narrative of nostalgia and nuance.","In the rugged terrains of Northern Norway, Dr. Lars Eriksson, a dedicated archaeologist, is leading a team to excavate Viking settlements. Though the region is rich with Viking history, Lars is searching for artifacts that predate even these ancient seafarers. What he discovers is beyond his wildest dreams: an immaculately preserved obsidian mirror, adorned with symbols that appear to come from various ancient civilizations.

Upon further examination in his Oslo lab, Lars realizes the mirror is not just a reflective surface—it's a portal. Every time he touches one of the symbols, he is transported to the time and place of its origin.

His first inadvertent touch sends him to ancient Egypt, during the reign of Pharaoh Akhenaten. There, he learns of the power struggles between old gods and new, witnessing firsthand the revolution of sun-worship.

Next, he finds himself amidst the towering ziggurats of Mesopotamia, where he mingles with Sumerian scholars and learns about their pioneering cuneiform script, the earliest form of writing.

In the heart of the Mayan civilization, Lars grapples with complex astronomical calculations and watches in awe as priests conduct intricate ceremonies to appease their deities.

Throughout his travels, Lars observes a recurring theme: the obsidian mirror was considered a treasured artifact in every civilization, revered for its power and mystery. Yet, with time, it was lost or deliberately hidden, with its last known location being with the Vikings.

However, the mirror's magic is unpredictable. With every use, Lars finds it harder to control where and when he'll end up. He soon realizes that the obsidian mirror is not merely a passive portal but has its own consciousness, testing Lars's wit, will, and intent.

While the physical dangers of these ancient worlds are evident, the more pressing threat comes from a shadowy figure that seems to follow Lars through time, trying to seize the mirror for its own sinister purposes. This mysterious entity, known as the Keeper, believes the obsidian mirror holds the key to unlimited power and domination.

With each jump through time, Lars collects pieces of a puzzle. Each civilization has left behind a clue on how to control and safeguard the mirror, ensuring it doesn't fall into the wrong hands.

Back in modern-day Oslo, Lars seeks the help of Dr. Freja Nilsen, a linguistics expert and old flame. Together, they decode the clues, each one a testament to humanity's shared history and the interconnectedness of our stories. Their research leads them to believe that the final clue, which could give them control over the mirror, lies somewhere in their own Norwegian heritage.

However, the Keeper isn't bound by time and has made its way to the present. In a gripping climax set amidst Norway's dramatic fjords and icy landscapes, Lars and Freja must outwit the Keeper, using their combined knowledge of the ancient worlds to trap it.

Having secured the mirror, Lars and Freja establish an international consortium of historians, archaeologists, and linguists, turning the obsidian portal into a tool for academic research. With strict guidelines and security measures, scholars from around the world get a firsthand experience of ancient civilizations, bridging gaps in our understanding of history.

Odyssey of the Obsidian is not just an adventure across time but a celebration of the tapestry of human civilization. It's a story that reminds us of our shared past and the timeless tales that continue to shape our present.",2019
64,Panda-monium,Animated kid's film about a panda with dreams of becoming a top chef despite the odds.,Han Lee,4.7,"A delightful concoction of humor, heart, and delicious visuals. Kids and adults will adore it!",Han Lee serves up a visual feast suitable for all ages.,"Beyond its humor, Panda-monium delivers an essential message about pursuing one's dreams.","In the heart of bustling Beijing, with its skyscrapers and traditional temples, lies ""Whisker Woods""—a magical anthropomorphic animal community. Among its charming residents is Ping, a jovial young panda with an insatiable appetite and a dream: to become a top chef. Despite his love for food, Ping's culinary experiments often end in, well, panda-monium! His dishes, though made with love, frequently turn out inedible. Yet, his spirit remains undeterred.

Ping's best friends, Meera, a clever mongoose, and Rajan, an enthusiastic red panda, are his biggest cheerleaders. They savor his rare successful dishes and suffer through the frequent disasters, always encouraging him to keep trying. One day, while exploring the human world, the trio stumbles upon a flyer for the ""Beijing Culinary Challenge,"" a prestigious cooking contest where the winner gets to train with the renowned Chef Anaya. This is Ping's chance to make his dream come true!

However, there are obstacles. Firstly, the contest is for humans, not animals. Secondly, the competition is fierce. Among the participants is the talented and arrogant chef, Vikram, known for his intricate dumplings, and the meticulous chef Aisha, famed for her exquisite noodle dishes.

Determined, the trio devises a plan. Using a blend of crafty disguises (with Meera riding atop Ping's shoulder to manage the ""head"" and Rajan handling the ""hands""), they manage to enter the competition as ""Chef Pandy."" They also convert an old treehouse into a makeshift kitchen for practice.

The days leading to the contest are filled with hilarious misadventures. From shopping for ingredients in the human market (imagine a panda trying to choose the freshest bamboo shoots) to learning about various cuisines, the trio is on a roll. Meera, with her knowledge of spices, becomes the ""taste tester,"" while Rajan, with his nimble hands, takes charge of intricate decorations.

The night before the contest, disaster strikes. Vikram, upon discovering their secret, destroys their makeshift kitchen. Devastated but not defeated, Ping and his friends rebuild their workspace with the help of Whisker Woods' residents, working through the night.

The day of the competition sees a whirlwind of activity. As ""Chef Pandy,"" they manage to impress the judges with their unique fusion dish—Bamboo Biryani. Their camaraderie, creativity, and genuine love for food shine through, capturing the audience's heart.

However, during the final round, their disguise comes undone. As the headpiece falls, revealing Ping's panda face, there's a gasp from the audience. But Chef Anaya, having tasted their dish, steps forward. She speaks about passion, creativity, and breaking barriers in the world of cooking. Addressing the audience, she asks if it matters who the chef is if the food speaks for itself.

The movie climaxes with Ping, Meera, and Rajan being awarded a special recognition for their extraordinary dish. Chef Anaya, true to her word, offers to train Ping, turning a section of her restaurant into an animal-friendly kitchen.

""Panda-monium"" concludes with a heartwarming scene. Ping's restaurant, ""Whisker Delights,"" opens in the heart of Whisker Woods. The once skeptical animal residents are now regular patrons, savoring dishes from around the world. As the camera zooms out, we see the bustling restaurant, with a sign that reads: ""Dreams served daily.""

With its colorful characters, vibrant setting, and a heartwarming message about following one's passion, ""Panda-monium"" promises to be a delightful treat for audiences of all ages.",2008
65,Paradise Lost,Two backpackers find a seemingly utopian village with a dark secret.,Brian Johnson,4.9,Paradise Lost is a masterful psychological thriller that keeps you guessing till its final moments.,"Brian Johnson crafts a suspenseful atmosphere so thick, it's intoxicating.","A haunting look at the human condition, Paradise Lost is a triumph of storytelling and direction.","Amid the pristine jungles of Southeast Asia, Sam and Jade, two adventurous backpackers, are on the hunt for the ultimate off-the-beaten-path experience. Having traveled through bustling cities and popular tourist spots, they hear whispers of a secluded village named ‘Pala’, untouched by modernity and said to be a slice of paradise.

Guided only by fragmented tales from locals, the duo embarks on a challenging trek, finally stumbling upon Pala. The village, surrounded by cascading waterfalls and emerald forests, is breathtakingly beautiful. Its inhabitants are welcoming, offering the backpackers shelter, food, and company.

Sam and Jade are introduced to the village elder, Matriarch Lina, who shares stories of Pala's rich history, traditions, and how the village lives in harmony with nature. Days are filled with communal activities - farming, fishing, dancing, and celebrations. Nights resonate with the melodic hum of folk songs around bonfires. Enchanted by the idyllic life and the community's warmth, Sam and Jade decide to extend their stay.

However, as days turn into weeks, they start noticing oddities. The village has no children, and there's a peculiar stone temple at the village's edge that they're forbidden from entering. Each night, a small group of villagers, including Matriarch Lina, visit this temple, their faces solemn and their chants hauntingly melancholic.

Curiosity piqued, Jade, with her knack for photography, decides to capture the night rituals secretly. She discovers that the villagers offer strange, luminescent fruits as offerings to an ancient deity depicted in the temple. These fruits, when consumed, seem to induce a trance-like state among the villagers.

When Sam tastes one of these fruits, he's hit with vivid hallucinations and memories, not his own, but those of various villagers. Through these visions, Sam uncovers the chilling truth: the deity that the village worships demands a sacrifice every decade to ensure the village's prosperity. The sacrificed are always outsiders, and in return, the deity ensures the villagers' longevity, explaining the absence of children.

Panicking, Jade and Sam confront Matriarch Lina, who sorrowfully admits to the village’s pact with the deity. She believes it's a necessary evil to preserve their way of life. Realizing they're the next intended sacrifices, the duo plans their escape.

The climax sees the village divided. While many, led by Matriarch Lina, believe in maintaining tradition, a faction opposes the sacrifices, having grown fond of Sam and Jade. A thrilling chase ensues through the treacherous jungle terrains as Sam and Jade, aided by their sympathizers, attempt to escape Pala's clutches.

Amidst the dense foliage and looming danger, the backpackers confront their worst fears and deepest insecurities. Jade's photographs play a pivotal role, revealing the village's history and the pain behind each sacrifice, turning more villagers against the ancient practice.

In the concluding showdown, the stone temple becomes the epicenter of conflict. As the opposing factions clash, a massive storm brews, and the deity, in the form of a colossal shadowy figure, emerges. With the village's history exposed and sentiments divided, the deity crumbles, symbolizing the end of an era and the shattering of blind traditions.

The movie ends with Pala rebuilding, now with children playing in its streets, signifying a new beginning. Sam and Jade, having survived their ordeal, depart with mixed emotions. While they leave behind the horrors, they also cherish the genuine connections they forged.

""Paradise Lost"" serves as a gripping narrative on the dangers of unchecked tradition and blind faith. It explores the thin line between preserving cultural heritage and the necessity of evolution, highlighting the idea that true paradise is achieved not by isolation or sacrifice, but by understanding, love, and unity.",1994
