ID,Movie Title,Description,Director,Star Rating,Critic Review 1,Critic Review 2,Critic Review 3,Synopsis,Year
90,Stellar Horizon,"Set in the year 2200, Stellar Horizon follows a crew of astronauts on a daring mission to explore a distant galaxy and uncover its hidden mysteries.",Robert West,4.6,"Stellar Horizon takes space exploration to new heights, combining thrilling space sequences with deep philosophical questions about our place in the universe.",A visually stunning cosmic journey that leaves you pondering the vastness of space and the potential for discovery.,"An interstellar epic that blends breathtaking visuals with introspective storytelling, creating a cinematic experience unlike any other.","In the not-so-distant future, humanity has established colonies on Mars and the Moon. The next grand venture lies beyond our solar system, and the mission, codenamed Stellar Horizon, is set to explore a newly discovered exoplanet in the Proxima Centauri system. Captain Emily Hart, an experienced astronaut with multiple interplanetary missions under her belt, is chosen to lead this groundbreaking journey.

Stellar Horizon's crew consists of six other specialists, each with their own expertise and emotional baggage. Dr. Jack Ridley, the mission's biologist, hopes to find signs of extraterrestrial life but is also escaping a failed marriage. Tessa Nguyen, the spacecraft’s engineer, is a prodigy in her field but has to prove she's more than just a young genius. The diverse team also includes experts in geology, communications, and medical fields.

The journey to Proxima Centauri is filled with psychological and physical tests as the team members spend years in stasis. Just when they are months away from reaching their destination, an unidentified object collides with their spacecraft. The collision causes significant damage to the ship, and even worse, the life support system is compromised. Tensions rise as the crew has to make emergency repairs while drifting in the emptiness of space.

Upon finally reaching the exoplanet, which they name Horizon Prime, the crew descends to the surface with a sense of relief and excitement. What they find defies imagination: a seemingly uninhabited world with an ecosystem much like Earth’s. As Dr. Ridley begins to discover signs of possible microbial life in the soil samples, the excitement quickly turns into a series of mysterious occurrences. Strange geometric patterns appear around their landing site, and their equipment begins to malfunction in inexplicable ways. Then, Tessa vanishes without a trace.

Captain Hart must keep her team together amid rising suspicions and paranoia. Each member starts questioning the others' loyalties and motives, wondering if the strange events are being caused by one of them—or something else entirely. In a daring move, Hart decides to venture into a cave system where they believe the geometric patterns originate. What they find inside is astonishing: evidence of an ancient civilization that had mastered the manipulation of time and space.

As they dig deeper, they unlock a hidden chamber where they find Tessa, who has aged significantly but only remembers being gone for what felt like minutes. They realize that they've stumbled upon a technology that manipulates time. Driven by this mind-bending revelation, the team debates whether to harness this newfound power to fix their damaged ship and life support system. However, using such technology could have unimaginable repercussions on the timeline of the universe.

Despite the risks, Captain Hart and her crew make a collective decision to utilize the technology. They manage to repair their ship and life support but decide to leave the technology on Horizon Prime, fearing its misuse. As they return to Earth, they find themselves hailed as heroes and pioneers but are forever haunted by the moral and existential questions raised by their discoveries.

Stellar Horizon offers a thrilling exploration of humanity's unquenchable thirst for knowledge, the ethical dilemmas that come with unchecked power, and the complex emotional fabric that holds a team together in the face of unprecedented challenges. The line between scientific curiosity and cosmic responsibility is blurred, leaving viewers to ponder the consequences of playing god in a universe still teeming with mysteries.",1977
91,Symphony of Silence,A deaf composer struggles to create a symphony that the world will never forget.,Patricia Walker,4.7,Patricia Walker's Symphony of Silence is a soul-stirring journey through sound and silence alike.,"A cinematic achievement that transcends the medium, making us experience music in a whole new way.","This film is a symphony in itself—beautifully composed, masterfully executed, and deeply moving.","In the heart of Vienna, the city of music, David Rennert, a talented young composer, is on the cusp of greatness. However, he harbors a secret that threatens to overshadow his immense talent: he is slowly losing his hearing. With each passing day, the world around him grows quieter, fading into a silent void.

David's passion for music began as a child, with memories of his mother singing lullabies that would lull him to sleep. This passion carried him through his formative years, earning him a place at Vienna's esteemed Music Academy. But now, facing an impending silence, David's fervor to leave an indelible mark in the world of music intensifies.

David's close friend and confidante, Clara, a talented violinist, discovers his secret when she notices subtle changes in his behavior and composition techniques. She urges David to seek medical help, but he's resistant, fearing societal rejection and the loss of his identity as a composer.

Instead, David becomes obsessed with creating a magnum opus, a symphony that would encapsulate all the sounds and emotions he fears he'll soon forget. He retreats from society, venturing into nature to capture its essence. He feels the vibrations of a hummingbird's wings, touches the rough bark of ancient trees, and lets raindrops fall onto his palms, translating these sensations into musical notes.

However, as his hearing deteriorates further, David struggles with isolation and mounting frustration. He experiences bouts of anger, throwing tantrums in his studio, ripping sheets of music, and even pushing Clara away when she attempts to intervene.

In his darkest moment, David visits the grave of his mother, reminiscing about their shared love for music. He recalls her words, ""Music isn't just heard, my love; it's felt deep within the soul."" This epiphany becomes a turning point.

David decides to collaborate with Clara, asking her to be his ears. Using a unique combination of touch-based communication and visual cues, the two embark on an unparalleled musical journey. Clara plays, David feels the vibrations, adjusts, and composes. Through this intimate collaboration, they not only create music but also develop a deeper bond, blurring the lines between friendship and love.

News of a deaf composer creating a groundbreaking symphony spreads, creating a buzz in Vienna's musical circles. The anticipation culminates in a grand concert, with David set to debut his masterpiece. The concert hall is packed, with whispers of skepticism and awe filling the air.

As the symphony begins, the audience is instantly captivated. David's composition is a mosaic of emotions, encompassing his journey from denial and anger to acceptance and passion. The crescendos evoke the beauty of sounds he once heard, while the soft notes embody the serenity of silence. By the end, the hall resonates not just with applause but with a collective emotional outpouring.

Post-concert, David's symphony is hailed as revolutionary, with many labeling it the ""Symphony of the Century."" But for David, the accolades are secondary. His true triumph lies in defying his circumstances, proving that art isn't bound by sensory limitations.

As the movie concludes, David, now completely deaf, stands atop a hill, feeling the wind against his face. Clara joins him, and they share a silent, profound moment, communicating not with words but with heartfelt emotion.

""Symphony of Silence"" is a poignant exploration of resilience, passion, and the transcendental power of music. It serves as a testament to the human spirit's ability to find beauty even in silence, echoing the timeless adage: when words fail, music speaks.",2023
92,Tango in Time,"Two rival dancers find a pair of shoes that transport them to significant moments in history, challenging their artistry.",Lucía Gutierrez,4.6,"Gutierrez orchestrates a dance of epochs, where rhythm meets time in a passionate embrace.","With each step, history and harmony converge in a tango of timeless tales.","Tango in Time takes audiences on a choreographed journey across centuries, celebrating the universal dance of life.","In the bustling heart of Buenos Aires, two renowned dancers, Eleanor ""Ellie"" Thompson and Rafael Castillo, rule the dance floor. Though equally talented, their rivalry is the stuff of legends, dividing fans and the dance community. Eleanor, with her precise and technically flawless moves, contrasts starkly with Rafael's raw passion and fiery interpretation of tango.

One day, in a quaint antique shop, Eleanor spots a pair of ornate tango shoes that seem to beckon her. Without a second thought, she buys them. At the same night's dance event, Rafael, intrigued by the shoes' unique design, convinces Eleanor to dance with him. But as they take their opening pose, a gust of wind swirls around them, and the room fades away.

They find themselves in war-torn Europe, specifically Paris during World War II. As they grapple with their sudden displacement in time and space, they realize that dancing might be their ticket back. With Eleanor's technical prowess and Rafael's emotive interpretations, they dance amidst air raids and blackouts. Their performance evokes hope and provides respite to the war-weary people. Upon finishing, they're whisked away once more by the mysterious power of the shoes.

This time, they emerge in Harlem during the Renaissance—a period of thriving arts and culture. Here, they are challenged to fuse tango with the energetic swing and jazz dances of the era. As they adapt to the fast-paced, lively moves, their combined styles become a showstopper, once again drawing attention and accolades. And just like before, as their dance concludes, they're transported yet again.

Their subsequent stops include the majestic courts of Spain during the Inquisition, where they must dance with enough passion to convince monarchs of their art's worth; the vibrant festivals of Rio de Janeiro in the 1920s, where samba reigns supreme; and a 1960s protest rally in Washington D.C., where their dance becomes a symbol of unity and harmony.

Throughout these time-traveling escapades, Eleanor and Rafael are exposed to a myriad of cultures and historical moments. These experiences deeply influence their dance styles, pushing them to new artistic heights. Moreover, relying on each other for survival and navigating the challenges of different eras together begins to mend the rift between them. Their initial rivalry morphs into a profound mutual respect and a budding romance.

However, the shoes, as they discover, have a mind of their own. They can't control when they'll be transported next, and there's always the looming fear of being stuck in a time period forever. In their search for answers, they encounter an elderly dancer during the Golden Age of Hollywood. She reveals that she was the shoes' first owner and warns them of the curse that comes with the shoes' power: if the dancers' bond ever breaks, they would be lost in time forever.

With this knowledge, Eleanor and Rafael realize that their growing emotional connection is the key to breaking the curse and returning home. Their final dance takes place in Ancient Greece, amidst philosophers, poets, and playwrights. It's here, under the Athenian moonlight, that they perform their most heartfelt and synchronized tango—a dance that encapsulates their shared adventures, challenges, and love.

As their performance concludes, they are finally transported back to Buenos Aires, amidst a cheering crowd who believed they witnessed an avant-garde performance piece. But Eleanor and Rafael know better. They decide to lock the shoes away, ensuring no one else gets ensnared in their time-traveling trap.

The film closes with Eleanor and Rafael, now a pair on and off the dance floor, establishing a dance academy where they teach not just tango moves but the rich history and stories behind every step.

Tango in Time is a mesmerizing blend of history, dance, and romance, reminding viewers that art transcends boundaries and that unity and understanding are the keys to overcoming any challenge.",1971
93,Temporal Tides,"A sailor lost at sea finds a mystical island where time behaves differently, leading to decades of adventures in days.",Wei Liu,4.7,"Liu crafts a maritime masterpiece, where waves of time crash and cascade in mesmerizing patterns.","Sail into a sea of suspense and surprise, where every tide turn brings time-twisting tales.","Temporal Tides anchors viewers in its depths, exploring the vast oceans of time and destiny.","In the roaring 1920s, Robert ""Rob"" Fletcher, a daring sailor with a penchant for challenging the unknown, is lost at sea during a solo voyage to circumnavigate the globe. As days turn into weeks with no land in sight and supplies running low, hope begins to wane. Just as despair sets in, a fierce storm sweeps him into the heart of a dense fog. When it clears, he finds himself facing an uncharted, ethereal island that isn't on any map.

As Rob steps ashore, he immediately senses that this isn't any ordinary island. The sands shimmer with golden specks, trees pulse with an iridescent glow, and the air is thick with an otherworldly energy. Exploring further, he encounters the island's inhabitants, the Temporians, who appear human but radiate a timeless aura. They reveal the island's secret: time here doesn't flow linearly but ebbs and flows like the tides. A day can span decades, or decades can condense into mere moments.

Intrigued and seeing an opportunity for unparalleled adventure, Rob decides to stay. He experiences lifetimes of adventures in what the outside world would consider mere days. He battles sea monsters, discovers hidden underwater cities, unravels ancient mysteries, and learns to harness the island's temporal energy. Along the way, he befriends Liana, a Temporian with a spirit as adventurous as his own. They share many escapades, from scaling the island's highest peaks to diving into its deepest caverns.

As the island's temporal tides shift, so do Rob's ages. One morning, he might wake up as a young man; by evening, he might have the wisdom of an elder. This constant flux of age and experience becomes both a blessing and a curse. While it grants Rob countless experiences, it also means fleeting moments with those he grows to care about.

Romance blossoms between Rob and Liana. Their love story, though filled with passion, is also marked by the heartbreak of time's unpredictable nature. Moments of youth and vitality are juxtaposed with periods of aging and reflection. They watch sunsets that seem to stretch for years and endure storms that age them prematurely.

However, as decades pass in the blink of an eye, a longing grows within Rob—a desire to reconnect with the world he left behind and share the tales of his adventures. But leaving the island has its risks. Outside its borders, time resumes its standard pace. Liana warns that if he leaves, he might never return, for the temporal tides are fickle and the island might vanish for centuries before reappearing.

Torn between his love for Liana and his longing for the world outside, Rob makes a heart-wrenching decision. Using a temporal compass crafted by the Temporians, he navigates through the shifting sands of time, hoping to find his way back to the 1920s.

As he sails away from the island, time readjusts. The decades he spent on the island condense, and he finds himself not much older than when he was lost. He returns to a world that presumed him dead, a legendary sailor who disappeared without a trace.

Reintegrating is challenging. The world sees him as a young man, but he bears the wisdom and memories of lifetimes. He pens down his adventures, and ""Temporal Tides"" becomes an instant literary classic, though many believe it's fiction.

The movie concludes with an elderly Rob, many years later, by the sea, compass in hand. The temporal pull of the island remains strong. As he gazes out into the horizon, the scene fades, leaving the audience to wonder if he ever made it back to Liana and the island that changed his life.

Temporal Tides is a captivating exploration of time, love, and the choices we make, all set against the backdrop of endless adventure and the haunting beauty of the unknown.",1966
94,The 13th Day,A team of soldiers must survive in a haunted battleground for 13 days.,Victor Hughes,2.9,Victor Hughes tries to blend war and horror but ends up misfiring on both fronts in The 13th Day.,"Despite its flaws, The 13th Day does offer some genuinely creepy moments.",Hughes falls into the trap of relying too heavily on jump scares and genre tropes.,"Amidst the deafening sounds of gunfire and echoing screams, the devastated landscape of Elmsworth, once a pristine village, now stands as a testimony to the ravages of war. Dubbed ""The Bloody Meadow"" due to a historic battle that took place centuries ago, legends whisper of souls that never left, forever trapped in an endless dance of combat.

Fast forward to World War II, and the Allies find themselves in need of a strategic point to hold back advancing enemy forces. Elmsworth is that point. A unit, Bravo Squad, composed of diverse soldiers from various backgrounds, is assigned this seemingly straightforward mission: hold the line at Elmsworth for 13 days until reinforcements arrive.

However, from their first night, it's evident that this is no ordinary mission. Watches stop functioning, radios emit chilling ghostly whispers instead of updates, and shadows dart in the peripheral vision of even the most hardened soldiers.

Each dawn, a haunting melody from an unseen source resonates across the meadow, making the surroundings eerily calm. The soldiers discover remnants of old trenches and war equipment, which seem to change positions overnight. By sunset, the environment turns hostile, with chilling mists and phantom apparitions of fallen warriors from bygone eras.

Bravo Squad's captain, a pragmatic and grounded man named Capt. Richard Hale, initially dismisses these incidents as stress-induced hallucinations. But when members of his team begin disappearing or found in a trance-like state recounting visions of past battles and long-dead soldiers, Hale can no longer deny the paranormal reality of Elmsworth.

The soldiers of Bravo Squad, already grappling with the tangible enemy outside their trenches, now face a more intangible, unpredictable foe. The spirits, it seems, are trapped in a loop, replaying their final moments and seeking to pull the living into their ghostly ranks.

A local historian, Marie, smuggled into the village by resistance fighters and familiar with Elmsworth's legends, offers insight. She reveals that the spirits are bound by the bloodshed and can only be freed when a 13-day battle concludes without blood spilled on the final day. This revelation presents Bravo Squad with an almost impossible dilemma: how to fend off an advancing enemy without resorting to violence on the last day.

As days turn to nights and the nights back into days, the boundaries between the living and the dead blur. Bravo Squad forms unlikely alliances with benevolent spirits, learning their stories and gaining insights into tactical advantages against the enemy.

However, not all spirits are friendly. Some, especially those from the opposing sides of their respective wars, seek to sabotage Bravo Squad's efforts, leading to intense supernatural confrontations.

By the 12th night, only half of Bravo Squad remains. With the enemy planning a massive assault on the 13th day, the odds look insurmountable. Yet, inspired by the sacrifices of their fallen comrades and the spirits they've befriended, Bravo Squad devises a plan. Using their knowledge of the terrain and the deceptive abilities of their spectral allies, they create illusions and diversions, delaying the enemy without direct confrontation.

The 13th day is a tense cat-and-mouse game, with both sides edging to the brink of violence but never crossing it. As sunset approaches, a massive face-off ensues at the center of Elmsworth, with Bravo Squad surrounded and outnumbered.

Just when all seems lost, the haunting melody that's been echoing every morning starts, now amplified, reverberating through every corner of the meadow. The spirits of Elmsworth rise, forming a protective barrier around Bravo Squad. In a climactic ethereal display, the spirits confront the enemy, not in violence, but with the raw emotion of their endless torment, driving the terrified soldiers away.

Nightfall on the 13th day witnesses an unprecedented event: Elmsworth, the Bloody Meadow, witnesses no bloodshed. The spirits, freed from their endless loop, salute Bravo Squad before fading into the night, finally at peace.

The movie concludes with the reinforcements arriving at dawn, finding an exhausted but alive Bravo Squad amidst a serene meadow. The war will continue elsewhere, but Elmsworth will forever remain a testament to the power of understanding, alliance, and the quest for peace amidst chaos.

""The 13th Day"" is a gripping tale of bravery, blending the horrors of war with supernatural suspense, emphasizing the unbreakable human spirit even when faced with forces beyond comprehension.",1974
