ID,Movie Title,Description,Director,Star Rating,Critic Review 1,Critic Review 2,Critic Review 3,Synopsis,Year
0,Arctic Chuckles,Penguins trying stand-up comedy to uplift spirits in the cold winter.,Sofia Mendoza,4.0,An endearing and hilarious animation that both kids and adults will adore.,"Mendoza showcases that humor is truly universal, even in the coldest corners of our planet. ","Pure joy from start to finish, it's the feel-good movie of the year. ","In the heart of the frosty Arctic, where the sun doesn't rise for months, the ever-joyful community of Emperor penguins waddle, sing, and dance to keep their spirits high during the long winter. However, this particular winter, an unusually harsh blizzard, nicknamed ""The Big Freeze,"" has lowered morale. The cold is biting, fish are scarce, and the community struggles to stay upbeat.

Enter Pip, a young penguin with an unusual talent: making others laugh. While others sing or dance, Pip has an arsenal of jokes and comedic stories, mostly centered around fish and snow. Seeing the gloom around him, he wonders, ""What if laughter can be the warmth we need?""

With his best friend, Finny, a penguin with impeccable timing and the perfect sidekick, Pip sets up a makeshift stage made of ice blocks. Every evening, under the shimmering Aurora lights, Pip and Finny perform - poking fun at the Arctic's daily life, the nuances of penguin waddles, and even the absurdity of The Big Freeze itself.

Word spreads, and soon penguins from neighboring communities shuffle over to witness ""Arctic Chuckles,"" the first-ever stand-up comedy show in the Arctic. Pip's humor, combined with Finny's hilarious physical comedy (including exaggerated falls and slapstick routines), becomes an instant hit.

Inspired by Pip and Finny, other penguins join the comedic bandwagon. There's Lulu, who does fantastic impersonations of seals and walruses, and the duo of Frosty & Snowflake, whose wit is as sharp as the icicles hanging from the glaciers.

But as the weeks go on, a challenge arises. The jokes start to become repetitive, and the novelty begins to wear off. The penguins are in need of fresh material, and Pip fears that the magic of ""Arctic Chuckles"" is fading.

Determined to reignite the spark, Pip and Finny decide to embark on a journey beyond their community, hoping to gain new experiences and stories for their comedy. Along the way, they encounter hilarious situations: a misunderstood conversation with a group of Arctic terns (who have a very different ""tern"" of phrase), a playful chase with a mischievous Arctic fox, and a dance-off with a group of puffins.

As they venture further, they stumble upon an old, wise walrus named Whisker, known to have the most extensive collection of tales in the Arctic. Whisker, amused by Pip and Finny's quest, shares some of the funniest and quirkiest stories from his vast collection.

Armed with these new tales, Pip and Finny return to their community, their spirits rekindled. Their comeback performance is nothing short of legendary. The tales from their journey, combined with Whisker's stories, leave the audience in splits. Laughter echoes across the icy expanse, and once again, warmth, albeit metaphorical, returns to the community.

As ""The Big Freeze"" finally starts to wane and the first rays of the sun begin to pierce the horizon, the penguins gather for one final performance. It's not just a comedy show; it's a celebration of resilience, community, and the undying spirit of joy.

""Arctic Chuckles"" concludes with the entire community dancing and laughing, with Pip and Finny in the center, reminding everyone that even in the coldest, darkest times, a chuckle can light the way.",1974
1,Ballad of the Lonely Lighthouse,"A reclusive lighthouse keeper's life is illuminated by unexpected friendships, challenging his solitary existence.",Dmitri Ivanov,4.9,"Ivanov’s storytelling brilliance shines as bright as the lighthouse, guiding audiences through waves of emotion.","A touching tale of isolation, connection, and the lights that lead us home.","Between the vast sea and towering lighthouse, this ballad sings of human connections in the most unlikely plac","In a remote coastal town, atop a craggy cliff stands the Beacon's End Lighthouse. Its rotating light has guided ships for decades, yet few ever come close to its isolated shores. The lighthouse's sole guardian is Arthur, a middle-aged man with a weathered face, reflective of years of battling the elements. For years, Arthur has lived in solitude, his life consumed by the rhythms of the sea and his duty to the lighthouse.

Arthur's life is one of routine: tending to the light, recording weather patterns, and making minor repairs to the lighthouse. His only companions are the sea birds and the occasional passing ship. The townsfolk respect him but also consider him an enigma, a man seemingly content in his solitude. But behind those aged eyes is a history of loss and heartbreak that led him to choose this isolated existence.

One stormy night, while Arthur is going about his routine, he spots a small boat in distress. With no coast guard nearby and the storm rapidly intensifying, he decides to brave the waves and attempt a rescue. He manages to pull a young woman named Clara from the tumultuous sea. She's a journalist who was traveling to cover a story about the oldest lighthouses and their keepers.

Clara, grateful for the rescue and intrigued by the mysterious lighthouse keeper, decides to stay a bit longer than intended. As she recovers, the two form an unexpected bond. Through shared meals and long conversations, Arthur slowly opens up, sharing stories of his past—of love lost, dreams unfulfilled, and the solace he found in the lighthouse.

Intrigued by his tales, Clara begins to write a story about him. She captures the essence of Arthur's life, portraying the beauty and loneliness of his existence. As days turn into weeks, the lighthouse becomes alive with laughter and music, its walls echoing tales of the sea and the hearts it has both broken and mended.

One day, as Arthur and Clara are walking on the beach, they discover a washed-up message in a bottle. It's a letter from a sailor to his love, expressing his longing to be reunited. This discovery becomes a daily ritual for them, with each message unveiling a new story, connecting Arthur and Clara to the vast world beyond the lighthouse.

Yet, as Clara's stay extends, the town becomes abuzz with rumors. Curious visitors begin to arrive at the lighthouse, transforming it from an isolated beacon to a hub of activity. The once-reclusive Arthur finds himself at the center of attention, and though initially resistant, he begins to embrace the change, realizing that human connections can light up one's world just as brilliantly as a lighthouse can illuminate the dark seas.

But all stories have their endings. Clara eventually has to return to her life in the city. The departure is bittersweet. While Arthur is sad to see her go, he's grateful for the time they shared and the new perspective she brought into his life.

The film closes with Arthur, no longer the lonely lighthouse keeper, hosting weekly gatherings at Beacon's End. The local townsfolk, sailors, and even tourists come to hear tales of the sea, share messages from bottles, and bask in the warmth of newfound friendships.

""Ballad of the Lonely Lighthouse"" is a poignant tale of isolation, connection, and the transformative power of human relationships. It serves as a testament to the idea that even in the most secluded corners of the world, there is a light waiting to be discovered, and sometimes, that light is found in the connections we forge with one another.",1963
2,Ballet & Bullets,An unexpected crime comedy about a mob boss who enrolls in a ballet class as a disguise.,Olga Ivanov,4.1,A dance of hilarity and unexpected twists. Ivanov's comedic touch is a sight to behold.,"It's 'The Godfather' meets 'Billy Elliot', with a splash of humor.",This ballet of bullets keeps you twirling between laughter and suspense.,"In the underbelly of New York City, Vincent ""Vinny"" Romano is a name that demands respect. A notorious mob boss, Vinny runs a vast empire that deals in everything from gambling rackets to the city's most sought-after speakeasies. With the Roaring Twenties in full swing, business is booming. But with increased profits come increased attention, especially from the relentless Detective Alvarez, who has made it his mission to bring Vinny down.

A tip-off from a mole within the police force alerts Vinny to an upcoming raid on his main hideout. Needing to lay low and devise a plan, he hatches an audacious idea inspired by a chance encounter: he'll disguise himself and hide in plain sight by enrolling in a local ballet class.

At the famed ""Luna Ballet Academy,"" Vinny's appearance is met with bemused stares. The school, run by the talented Russian émigrée Natalia Petrov, is a sanctuary for aspiring dancers. Among them are Aisha, a Kenyan immigrant with dreams of making it to the big stage; Carlos, a passionate dancer from Spain; and Ravi, an Indian prodigy blending traditional Kathak with classical ballet.

The early days are comical chaos. Vinny's bulk and lack of grace stick out like a sore thumb. His attempts to execute delicate pirouettes result in him crashing into mirrors or toppling fellow dancers. But under Natalia's stern tutelage, and with encouragement from his classmates, Vinny slowly starts to improve. He even begins to appreciate the art, finding in dance an unexpected outlet for the stress and tension of his criminal life.

Meanwhile, Detective Alvarez is getting closer. He's sniffed out the mole within the police force, and an intense game of cat-and-mouse ensues. Vinny's underlings, led by the sharp-witted Rosa and the imposing Enzo, are working around the clock to throw Alvarez off the scent, but it's only a matter of time before the detective zeroes in on the ballet academy.

Amidst pirouettes and pliés, Vinny forms close bonds with his classmates. Aisha becomes like a sister to him, while Ravi and Carlos, initially wary of the mobster, come to appreciate his loyalty and unexpected vulnerability. Natalia, too, finds herself drawn to Vinny, seeing beyond the rough exterior to the man beneath.

The climax unfolds during the academy's annual recital. As Vinny, dressed in a flamboyant costume, prepares for his debut performance, Alvarez and his team surround the theater. Unbeknownst to them, Rosa and Enzo have orchestrated a diversion: a fake bank heist across town, pulling most of the police force away.

On stage, Vinny delivers a surprisingly moving performance, a mix of raw emotion and newfound grace. The audience, including several of his bemused mob associates, gives him a standing ovation. But as the curtains fall, Alvarez confronts him backstage.

Just when things look dire for Vinny, Natalia steps in. She confesses that she had been working with Alvarez all along, offering the academy as bait to catch Vinny. But her feelings for the mob boss are genuine, and she can't go through with the arrest. In a tense standoff, Vinny makes a bold offer to Alvarez: he'll leave the criminal world behind if the detective lets him and his new family walk away.

Touched by Vinny's transformation and the palpable bond he shares with the dancers, Alvarez agrees, but on one condition: Vinny must perform one last dance, just for him.

The film closes with Vinny, in full ballet attire, executing a hilariously imperfect but heartfelt dance, as Alvarez watches, a smirk playing on his lips. The mobster might have hung up his criminal boots, but in the world of ballet, he's just getting started.

End Credits Roll with a jazzed-up version of Tchaikovsky's ""Swan Lake.""",1995
3,Bazaar of Bewildering Bees,"A beekeeper discovers her bees produce honey that lets consumers relive memories, leading to sweet chaos.",Nia Jones,4.6,"Jones buzzes with creativity, crafting a world dripping with nostalgia and nectar.","An un-bee-lievably heartwarming hive of humor, honey, and heartfelt moments.",This bazaar isn't just bustling; it's a bee-autiful blend of memories and mirth.,"Amidst the verdant landscapes of Hawaii, with its intoxicating blend of lush rainforests, scenic coastlines, and tranquil beaches, lives Leilani, a dedicated beekeeper and island native. She runs ""Leilani's Honey Haven"" near the edge of a dense tropical forest, maintaining traditional beekeeping methods passed down from her ancestors.

One morning, after a peculiar lunar eclipse rumored to possess mysterious energies, Leilani notices a change in her beehives. The bees have started to produce a luminescent honey with a silvery-gold hue. Curious, she tastes it and is immediately enveloped in a vivid memory of her childhood, playing along the shoreline with her late father.

Realizing the power of this mystical honey, Leilani shares her discovery with her close friend, Kimo. They decide to introduce it at the upcoming local bazaar, with a stall named ""Bazaar of Bewildering Bees."" Word quickly spreads about honey that can evoke powerful, lifelike memories. Soon, there's a constant queue of locals and tourists eager to sample and purchase jars of the enchanted honey.

As more people indulge, tales of their experiences with the honey start to circulate. An elderly couple reexperiences their first dance, reigniting their love. A man is transported back to a memory of his son's laughter, finding closure over his tragic loss. A woman remembers the comforting embrace of her mother, allowing her to finally let go of years of resentment.

However, with the immense power of this honey also comes unpredictability. Some are thrust into less than pleasant memories, reawakening old wounds and conflicts. A local businessman, Ailani, recalls a deceitful act from his past, leading to a confrontation and deep regrets. Teenager Malia relives an embarrassing moment from school, causing her emotional distress.

Furthermore, the sudden boom in business attracts the attention of greedy entrepreneurs who see an opportunity to commercialize the magical honey. They approach Leilani with lucrative offers to mass-produce and distribute it worldwide.

Torn between the potential wealth and her sense of responsibility towards her bees and the island's heritage, Leilani retreats to the heart of the forest. Here, she encounters the spirit of her ancestors in a dreamlike vision. They remind her of the sanctity of nature and her role as its protector. They also reveal that the lunar eclipse's energies were a one-time gift, not meant for exploitation.

Emerging with newfound clarity, Leilani decides to cease the sale of the mystical honey. Instead, she sets up sessions where individuals can partake in the honey under her guidance, ensuring a safe and healing environment.

The climax unfolds at the final grand session at the bazaar. As people come forward, sharing their memories and experiences, the community becomes tightly knit, understanding each other's joys, sorrows, and histories. The event culminates in a traditional Hawaiian celebration of song, dance, and stories, honoring the island's heritage and the ephemeral magic of the bewitching bees.

Bazaar of Bewildering Bees is a heartwarming tale that underscores the importance of cherishing memories, respecting nature's gifts, and the deep-rooted traditions that bind communities together. Through Leilani's journey, viewers are reminded that some wonders, while temporary, have a lasting impact on our souls.",1991
4,Beneath Northern Lights,An arctic explorer finds a hidden village where the aurora borealis has magical powers.,Magnus Olsson,4.6,"Olsson paints a breathtaking icy tableau filled with mystery, magic, and mesmerizing visuals.",A chilling tale of wonder beneath the dance of ethereal lights.,"From the icy landscapes to the warm village tales, this movie shines as bright as its namesake.","In the remote expanses of the Arctic, Viktor Lindberg, a seasoned Swedish explorer with a rugged beard and a heart full of wanderlust, is on a mission to document the ethereal beauty of the Northern Lights. He's driven not just by his professional quest but by a personal one: a letter from his late grandmother, telling tales of a mysterious village beneath the aurora borealis, where the lights are said to possess magical powers.

Viktor's journey is perilous. He faces unforgiving storms, treacherous ice, and the haunting solitude of the Arctic. But his determination is unwavering. Guided by the old maps from his grandmother's attic and her tales, he traverses the icy landscapes.

One evening, as the green and purple lights dance passionately across the sky, Viktor stumbles upon an ice crevasse. A nearly fatal fall is thwarted by a mysterious force: the Northern Lights stretch down, cradling him in their glow, and gently place him on the other side. Before him lies an awe-inspiring sight – a hidden village illuminated by the ever-present aurora borealis.

The village, named Ljuslandet (Land of Light), is home to the Ljusfolk, descendants of ancient Arctic dwellers who've been blessed with the magic of the Northern Lights. They can harness the lights’ energy, heal wounds, communicate telepathically, and even control the elements to some extent. But with the blessings come rules – they must never leave the village, or the magic will be lost.

Viktor is welcomed by Freja, a young Ljusfolk woman with shimmering blue eyes. She becomes his guide, showing him their ways, their celebrations, and the deep respect they have for the magic that surrounds and infuses them. In return, Viktor shares tales of the world beyond, a world Freja has never seen but only dreamt of.

As the days turn into nights and nights back into days, Viktor finds himself drawn to both the village and Freja. But he soon discovers a looming threat: the melting ice caps, a result of global warming, are endangering Ljuslandet. If the village is exposed, the magic of the Northern Lights might be lost forever.

Determined to help, Viktor devises a plan to relocate the village. Using his knowledge of modern technology and the Ljusfolk's elemental abilities, they work together to create a new sanctuary. The process isn't easy. They face challenges, both from nature and from among the Ljusfolk, some of whom resist the change.

During this time, Viktor and Freja's bond deepens. But a painful decision looms. Freja wishes to see the world beyond, with Viktor, risking the loss of her magical essence. Viktor, on the other hand, contemplates staying, to be part of a world he once thought was just a tale.

The climactic night arrives when a massive iceberg threatens to crash into Ljuslandet. With combined effort and the unparalleled power of the Northern Lights, the village is safely moved, and the iceberg's path diverted. Ljuslandet, though relocated, remains hidden, its magic intact.

Having saved the village, Viktor decides it's time for him to return to his world, but not without Freja. As they step out of Ljuslandet, Freja’s magic begins to wane, but she's undeterred. She's eager to create new memories, away from the constant glow of the Northern Lights.

The movie concludes with Viktor and Freja, hand in hand, exploring the world, with the aurora borealis occasionally lighting up the night sky, a gentle reminder of the magical village beneath the Northern Lights.",1988
5,Beneath Silent Skies,"An astronaut's lone journey on an alien planet, seeking signs of life.",Iris Thorne,4.7,"A poignant, atmospheric drama that transcends the typical sci-fi trope, Beneath Silent Skies offers a reflective narrative that could only be matched by its stunning visuals. Watching the astronaut navigate an uncharted world isn't just about the search for alien life; it becomes a personal quest for meaning, a sort of cosmic soul-searching that resonates deeply. The isolation isn't a punishment but a crucible for transformation. What could have been a one-dimensional survival story is elevated to a meditative exploration of solitude and the human condition.
","Beneath Silent Skies plunges us into an alien world but holds us with very human emotions. The film delivers on suspense and awe-inspiring planetary landscapes, yet its triumph lies in its minimalist storytelling. The loneliness of the astronaut is palpable, and the movie tackles the weighty topics of existence and identity without ever feeling preachy. The filmmaker understands that sometimes, silence speaks louder than words. The result is a spellbinding experience that leaves you questioning what it means to be truly alone—or truly alive.","A cerebral odyssey that’s as visually resplendent as it is emotionally charged. Beneath Silent Skies steers clear of the bombast that often dominates the sci-fi genre, opting instead for a quieter but equally gripping narrative that unfolds in the far reaches of an alien world. Its true genius lies in its ability to make you feel intimately connected to its lone character, an astronaut adrift in an impossibly vast universe. This is more than just a movie; it's a hauntingly beautiful contemplation of life, loneliness, and the universe.","In the not-so-distant future, humanity has spread its influence across the stars. Interstellar travel is now a reality, and among the plethora of explorers and pioneers is astronaut Dr. Evelyn Evie Carter. But even in this age of cosmic discovery, Evie finds herself faced with an unprecedented challenge: she is the sole crew member aboard the spacecraft Icarus, sent to investigate a mysterious signal emanating from an uncharted exoplanet named Veritas-7.

As Evie lands on the barren yet strangely captivating landscape, she quickly realizes she is not alone—Veritas-7 is alive, breathing in its own cosmic rhythm, its sky filled with silent storms and hidden rainbows. But there are no birds, no animals, no signs of what Earthlings would call life. It is a planet of profound quiet, eerie in its serenity.

The mission is clear: to find the origin of the mysterious signal. Guided by her scientific training and her unwavering resolve, Evie embarks on a journey across this alien world. Each step is a movement through geological wonders and bizarre environmental phenomena. Enormous crystal caves hum softly as she passes, and underground lakes emit a bioluminescent glow, like stars mirroring the universe above.

Yet, the signal remains elusive. It doesn't take long for Evie to understand that Veritas-7 is not merely a rock floating in space; it's an entity with a consciousness. The more she investigates, the more she starts to see patterns—the planet itself seems to be communicating with her, guiding her, leading her to an indescribable discovery.

The turning point comes when Evie stumbles upon an alien relic—an ancient structure that stands as a monument to an extinct civilization. Within its walls, she discovers the source of the signal: an orb of immense power that seems to hold the consciousness of the planet. As she touches the orb, she finds herself connected to the essence of Veritas-7. Memories flood her mind—memories of an ancient civilization that destroyed itself in the pursuit of technological advancement, leaving their planet as their last living testament.

The planet's message is clear: life is a cycle of noise and silence, creation and destruction. And in that moment, Veritas-7 becomes not just an entity but a prophet warning against the possible fate of Earth.

Evie faces a moral dilemma. She can take the orb back to Earth as proof of her findings—a discovery that would revolutionize our understanding of life and the universe. But she fears humanity may misuse this power, thereby fulfilling the tragic cycle Veritas-7 seeks to prevent. After wrestling with her decision, she chooses to leave the orb and the consciousness of the planet where they belong, under the silent skies of Veritas-7.

The final scenes find her recording her last log aboard the Icarus. Rather than provide the empirical evidence her superiors would expect, she speaks of the wisdom and the poetic silence of Veritas-7, knowing that her words might not be understood, but hoping that the message would resonate somewhere, somehow, in the ceaseless chatter of human existence.

As the Icarus lifts off, soaring into the depths of space, the camera zooms out to reveal the silent face of Veritas-7, now a part of Evie and, through her, a whisper in the collective consciousness of mankind—beneath its silent skies lies the soundless echo of what it means to be alive.

Beneath Silent Skies is a soul-stirring journey that blends science fiction with existential philosophy. It explores the duality of existence, questions the essence of life and purpose, and challenges the audience to listen, even when all seems quiet.",1977
